{
  "contract": "contract1_raw_dataset",
  "contract_version": "DRAFT v0",
  "manifest_id": "raw-synthetic-001",
  "dataset": {
    "dataset_id": "synthetic-contract1",
    "name": "Contract 1 synthetic fixture",
    "source_url": "https://example.invalid/synthetic-contract1",
    "dataset_version_or_acquisition_tag": "test-2026-09-15",
    "package_checksum": {
      "algorithm": "sha256",
      "value": "aaaaaaaaaaaaaaaaaaaaaaaaaaaaaaaaaaaaaaaaaaaaaaaaaaaaaaaaaaaaaaaa"
    },
    "license_usage_notes": "Synthetic bytes only; not a redistributable dataset.",
    "geometry_validation_status": "VALIDATED_AXIS_ALIGNED",
    "split_protocol_id": null
  },
  "gate": {
    "gate_data_01": "ACCEPTED",
    "validated_manifest_uri": "artifact://manifests/raw-synthetic-001"
  },
  "cases": [
    {
      "case_id": "CASE_0001",
      "dataset_id": "synthetic-contract1",
      "source_case_key": "synthetic-case-1",
      "mode_capability": "EVALUATION",
      "volume_id": "VOL_CASE_0001",
      "ground_truth_mask_id": "MASK_CASE_0001",
      "mri_volume": {
        "volume_id": "VOL_CASE_0001",
        "artifact_uri": "artifact://datasets/synthetic-contract1/CASE_0001/mri.nrrd",
        "source_path": "mri.nrrd",
        "format": "NRRD",
        "shape_xyz": [2, 2, 1],
        "spacing_xyz": [2, 3, 4],
        "origin_xyz": [10, 20, 30],
        "direction_or_orientation": [
          [1, 0, 0],
          [0, 1, 0],
          [0, 0, 1]
        ],
        "dtype": "uint8",
        "checksum": {
          "algorithm": "sha256",
          "value": "a9bd768ce32a3c4c10848be85a464e618879fcd2fff27c527e3f8519519c9b3a"
        },
        "geometry_validation_status": "VALIDATED_AXIS_ALIGNED"
      },
      "ground_truth_mask": {
        "mask_id": "MASK_CASE_0001",
        "artifact_uri": "artifact://datasets/synthetic-contract1/CASE_0001/mask.nrrd",
        "source_path": "mask.nrrd",
        "format": "NRRD",
        "shape_xyz": [2, 2, 1],
        "spacing_xyz": [2, 3, 4],
        "origin_xyz": [10, 20, 30],
        "direction_or_orientation": [
          [1, 0, 0],
          [0, 1, 0],
          [0, 0, 1]
        ],
        "dtype": "uint8",
        "checksum": {
          "algorithm": "sha256",
          "value": "f736d96ae8310150a4fba07c5e27dcc17c3cff6c4ed268dec8491eb9e20e278c"
        },
        "geometry_validation_status": "VALIDATED_AXIS_ALIGNED",
        "label_semantics": "LA cavity",
        "source": "dataset annotation",
        "label_values": [0, 255],
        "foreground_value": 255,
        "background_value": 0
      },
      "compatibility": {
        "shape_equal": true,
        "spacing_equal": true,
        "origin_equal": true,
        "directions_equal": true,
        "resampling_required": false
      },
      "metadata": {
        "modality": "MR",
        "space": "left-posterior-superior",
        "encoding": "raw",
        "source_partition": "Synthetic"
      }
    }
  ]
}
